{
  "$schema": "http://json-schema.org/draft-07/schema#",
  "$id": "https://github.com/wlfghdr/agentic-enterprise/schemas/knowledge-manifest.schema.json",
  "title": "Knowledge Manifest",
  "description": "Versioned manifest for governed knowledge sources that agents may rely on.",
  "type": "object",
  "required": ["schema_version", "knowledge_id", "version", "title", "layer", "scope", "owners", "sources", "freshness"],
  "additionalProperties": false,
  "properties": {
    "schema_version": { "type": "string", "enum": ["1.0"] },
    "knowledge_id": { "type": "string", "pattern": "^[a-z0-9-]+$" },
    "version": { "type": "string", "pattern": "^\\d+\\.\\d+\\.\\d+$" },
    "title": { "type": "string", "minLength": 1 },
    "description": { "type": "string" },
    "layer": { "type": "integer", "enum": [1, 2, 3, 4], "description": "Knowledge layering tier: 1 org-wide, 2 capability/domain, 3 product surface, 4 repo-local." },
    "scope": { "type": "string", "enum": ["org-wide", "capability", "product", "repo"] },
    "status": { "type": "string", "enum": ["draft", "active", "deprecated", "retired"] },
    "owners": {
      "type": "array",
      "minItems": 1,
      "items": {
        "type": "object",
        "required": ["role"],
        "additionalProperties": false,
        "properties": {
          "role": { "type": "string" },
          "team": { "type": "string" },
          "contact": { "type": "string" }
        }
      }
    },
    "sources": {
      "type": "array",
      "minItems": 1,
      "items": {
        "type": "object",
        "required": ["kind", "path"],
        "additionalProperties": false,
        "properties": {
          "kind": { "type": "string", "enum": ["repo-path", "repo-glob", "external-url", "generated-artifact"] },
          "path": { "type": "string" },
          "notes": { "type": "string" }
        }
      }
    },
    "freshness": {
      "type": "object",
      "required": ["review_cadence", "owner"],
      "additionalProperties": false,
      "properties": {
        "review_cadence": { "type": "string", "enum": ["per-change", "weekly", "monthly", "quarterly", "semiannual", "annual"] },
        "max_age_days": { "type": "integer", "minimum": 1 },
        "owner": { "type": "string" },
        "last_reviewed": { "type": "string", "format": "date" }
      }
    },
    "discovery": {
      "type": "object",
      "additionalProperties": false,
      "properties": {
        "tags": {
          "type": "array",
          "items": { "type": "string" }
        },
        "audiences": {
          "type": "array",
          "items": { "type": "string" }
        },
        "depends_on": {
          "type": "array",
          "items": { "type": "string" }
        }
      }
    },
    "usage_constraints": {
      "type": "array",
      "items": { "type": "string" }
    },
    "change_log": {
      "type": "array",
      "items": {
        "type": "object",
        "required": ["version", "date", "change"],
        "additionalProperties": false,
        "properties": {
          "version": { "type": "string" },
          "date": { "type": "string", "format": "date" },
          "change": { "type": "string" }
        }
      }
    }
  }
}
